source_id,source_name,publisher,jurisdiction,coverage,source_category,catalogue_page,download_endpoint,api_endpoint,access_method,file_format,licence_name,licence_url,redistribution_allowed,attribution_required,share_alike_or_database_obligation,postal_code_present,postal_code_field,postal_code_level,address_present,coordinate_present,geometry_type,coordinate_reference_system,unit_or_suite_present,building_or_property_id_present,status_field_present,release_date,last_updated,expected_update_frequency,record_count,ontario_record_count,distinct_ontario_postal_codes,valid_postal_code_count,invalid_postal_code_count,missing_postal_code_rate,duplicate_rate,source_lineage,known_limitations,proposed_role,priority,verification_status,notes
statcan_nar,National Address Register,Statistics Canada,Federal,National,Category A,https://www.statcan.gc.ca/en/lode/databases/nar,N/A,N/A,direct_download,CSV,Open Government Licence - Canada,https://open.canada.ca/en/open-government-licence-canada,true,true,false,true,postal_code,address,true,true,point,EPSG:4326,true,true,true,2024,2024,annual,unknown,unknown,unknown,unknown,unknown,unknown,unknown,Extracted from Statistics Canada Building Register and municipal data,Replaces ODA; current authoritative federal open address source,primary,1,verified,Authoritative source replacing the ODA.
statcan_oda,Open Database of Addresses,Statistics Canada,Federal,National,Category A,https://www.statcan.gc.ca/en/lode/databases/oda,N/A,N/A,direct_download,CSV,Open Government Licence - Canada,https://open.canada.ca/en/open-government-licence-canada,true,true,false,true,postal_code,address,true,true,point,EPSG:4326,true,true,false,2021,2021,superseded,unknown,unknown,unknown,unknown,unknown,unknown,unknown,Municipal and provincial open data harmonized by StatCan,Archived dataset superseded by NAR,rejected,1,verified,Superseded by National Address Register.
geonames_ca,GeoNames Canadian Postal Codes,GeoNames,International,National,Category A,https://download.geonames.org/export/zip/,https://download.geonames.org/export/zip/CA_full.csv.zip,N/A,direct_download,CSV,Creative Commons Attribution 4.0,https://creativecommons.org/licenses/by/4.0/,true,true,false,true,postal_code,postal_code,false,true,point,EPSG:4326,false,false,false,2024,2024,daily,1687127,298607,unknown,298607,0,0,unknown,Unknown crowdsourced and derived,Point precision only; no civic addresses,supplementary,1,verified,High valid count but lacks addresses.
ontario_pcd,Canada Postal Code Data,Ontario Ministry of the Attorney General,Provincial,Ontario,Category A,https://data.ontario.ca/,N/A,N/A,restricted,N/A,Restricted,N/A,false,false,false,true,unknown,unknown,unknown,unknown,unknown,unknown,unknown,unknown,unknown,unknown,unknown,unknown,unknown,unknown,unknown,unknown,unknown,unknown,unknown,Possible Canada Post PCCF derivation,Restricted dataset not available to public,quarantined,1,verified,Data is marked as restricted on the Ontario Data Catalogue.
osm_ontario,OpenStreetMap Ontario,OpenStreetMap Contributors,International,Ontario,Category A,https://download.geofabrik.de/north-america/canada/ontario.html,https://download.geofabrik.de/north-america/canada/ontario-latest.osm.pbf,N/A,direct_download,PBF,Open Data Commons Open Database License (ODbL),https://opendatacommons.org/licenses/odbl/,true,true,true,true,addr:postcode,address,true,true,point_and_polygon,EPSG:4326,true,true,false,daily,daily,daily,unknown,unknown,unknown,unknown,unknown,unknown,unknown,Crowdsourced mapping,ODbL requires share-alike; must be kept as separate layer,supplementary,2,verified,ODbL obligations mean it must not contaminate other sources.
toronto_addresses,Toronto Address Points,City of Toronto,Municipal,Toronto,Category C,https://open.toronto.ca/dataset/address-points-municipal-toronto/,https://ckan0.cf.opendata.inter.prod-toronto.ca/dataset/address-points-municipal-toronto/download,N/A,direct_download,CSV,Open Government Licence - Toronto,https://open.toronto.ca/open-data-license/,true,true,false,true,POSTAL_CODE,address,true,true,point,EPSG:4326,true,true,true,2024,2024,weekly,unknown,unknown,unknown,unknown,unknown,unknown,unknown,Municipal authoritative property data,None,authoritative_local,2,unverified,Will form part of municipal aggregation.
ottawa_addresses,Ottawa Municipal Addresses,City of Ottawa,Municipal,Ottawa,Category C,https://open.ottawa.ca/datasets/ottawa::municipal-addresses,https://opendata.arcgis.com/api/v3/datasets/municipal-addresses/downloads/data?format=csv,N/A,direct_download,CSV,Open Government Licence - Ottawa,https://open.ottawa.ca/pages/open-data-licence,true,true,false,true,POSTAL_CODE,address,true,true,point,EPSG:4326,true,true,true,2024,2024,weekly,unknown,unknown,unknown,unknown,unknown,unknown,unknown,Municipal authoritative property data,None,authoritative_local,2,unverified,Authoritative for Ottawa.
